{"schemaVersion":1,"startMjdUtc":49876,"recordCount":4096,"dut1QualityRanges":[[0,4096,"I"]],"polarMotionQualityRanges":[[0,4096,"I"]],"dut1MicrosecondsDelta":[-18757,-2446,-2371,-2259,-2143,-2055,-2037,-2081,-2125,-2192,-2243,-2247,-2201,-2112,-1982,-1814,-1614,-1416,-1269,-1169,-1125,-1148,-1231,-1352,-1496,-1637,-1734,-1765,-1740,-1686,-1607,-1518,-1446,-1416,-1443,-1517,-1605,-1700,-1757,-1747,-1666,-1534,-1378,-1219,-1066,-942,-859,-820,-822,-859,-926,-1020,-1139,-1270,-1379,-1440,-1432,-1385,-1331,-1300,-1305,-1353,-1444,-1562,-1681,-1761,-1783,-1747,-1666,-1567,-1467,-1375,-1314,-1299,-1320,-1373,-1452,-1538,-1648,-1795,-1950,-2064,-2134,-2112,-2064,-2016,-1978,-1961,-1974,-2026,-2107,-2193,-2281,-2345,-2342,-2269,-2155,-2031,-1921,-1852,-1824,-1827,-1853,-1898,-1969,-2114,-2285,-2449,-2582,-2668,-2691,-2645,-2536,-2420,-2335,-2305,-2336,-2414,-2509,-2580,-2638,-2675,-2670,-2602,-2471,-2308,-2172,-2048,-1950,-1911,-1919,-1974,-2068,-2160,-2241,-2343,-2431,-2467,-2462,-2426,-2365,-2294,-2252,-2275,-2357,-2482,-2621,-2741,-2774,-2723,-2625,-2498,-2373,-2262,-2158,-2049,-1979,-1973,-2033,-2143,-2297,-2491,-2649,-2752,-2833,-2875,-2867,-2815,-2732,-2660,-2628,-2645,-2699,-2760,-2807,-2818,-2764,-2662,-2552,-2447,-2335,-2225,-2135,-2091,-2099,-2154,-2232,-2322,-2427,-2548,-2621,-2646,-2651,-2653,-2626,-2572,-2499,-2444,-2452,-2539,-2665,-2757,-2783,-2734,-2614,-2442,-2240,997968,-1844,-1695,-1593,-1543,-1554,-1631,-1747,-1856,-1932,-1976,-1995,-2000,-1992,-1967,-1925,-1859,-1778,-1752,-1820,-1945,-2075,-2146,-2129,-2055,-1937,-1800,-1656,-1528,-1430,-1378,-1385,-1447,-1548,-1658,-1767,-1874,-1989,-2090,-2144,-2144,-2102,-2037,-1970,-1928,-1929,-1996,-2134,-2306,-2466,-2567,-2584,-2521,-2365,-2141,-1958,-1847,-1792,-1773,-1785,-1862,-1986,-2128,-2279,-2417,-2520,-2585,-2613,-2606,-2572,-2515,-2424,-2307,-2208,-2184,-2229,-2310,-2387,-2434,-2440,-2397,-2295,-2161,-2036,-1946,-1888,-1865,-1879,-1935,-2020,-2126,-2244,-2371,-2472,-2504,-2502,-2474,-2416,-2345,-2284,-2263,-2303,-2389,-2489,-2565,-2588,-2559,-2480,-2374,-2220,-2067,-1961,-1912,-1890,-1901,-1949,-2023,-2128,-2252,-2368,-2472,-2557,-2619,-2625,-2564,-2469,-2377,-2328,-2341,-2409,-2502,-2600,-2667,-2672,-2612,-2498,-2358,-2191,-2023,-1886,-1785,-1709,-1664,-1674,-1718,-1778,-1850,-1915,-1956,-1965,-1944,-1876,-1781,-1693,-1647,-1665,-1742,-1833,-1922,-1998,-2050,-2059,-2002,-1891,-1748,-1594,-1443,-1305,-1230,-1199,-1210,-1267,-1352,-1440,-1522,-1572,-1582,-1551,-1507,-1431,-1329,-1235,-1179,-1181,-1249,-1368,-1450,-1461,-1411,-1323,-1214,-1100,-1002,-912,-837,-811,-827,-873,-936,-1015,-1106,-1182,-1245,-1291,-1321,-1335,-1338,-1304,-1244,-1220,-1265,-1376,-1535,-1688,-1764,-1730,-1594,-1402,-1206,-1024,-861,-745,-688,-665,-692,-751,-823,-908,-1000,-1089,-1151,-1174,-1169,-1146,-1125,-1116,-1110,-1134,-1213,-1344,-1503,-1685,-1796,-1801,-1708,-1545,-1356,-1174,-1044,-960,-929,-937,-998,-1118,-1294,-1507,-1678,-1774,-1814,-1806,-1751,-1663,-1595,-1569,-1599,-1672,-1816,-2008,-2200,-2335,-2361,-2288,-2150,-2001,-1878,-1784,-1657,-1575,-1553,-1591,-1652,-1736,-1836,-1944,-2032,-2090,-2116,-2113,-2074,-2010,-1941,-1890,-1906,-2014,-2144,-2258,-2354,-2442,-2453,-2366,-2221,-2050,-1890,-1754,-1655,-1619,-1630,-1694,-1801,-1930,-2060,-2137,-2179,-2184,-2135,-2079,-2041,-2024,-1972,-1881,-1841,-1916,-2021,-2108,-2158,-2161,-2099,-1980,-1845,-1732,-1649,-1603,-1575,-1574,-1599,-1646,-1689,-1719,-1742,-1783,-1808,-1794,-1747,-1691,-1647,-1632,-1661,-1730,-1840,-1969,-2074,-2141,-2168,-2158,-2085,-1968,-1854,-1777,-1723,-1683,-1674,-1701,-1753,-1818,-1886,-1943,-1986,-2004,-2002,-1974,-1926,-1877,-1840,-1840,-1885,-1966,-2071,-2161,-2216,-2236,-2202,-2114,-1981,-1820,-1658,-1529,-1443,-1413,-1443,-1479,-1490,-1526,-1581,-1639,-1659,-1603,-1538,-1483,-1386,-1297,-1262,-1304,-1443,-1625,-1819,-1966,-2038,-2073,-2064,-1945,-1797,-1683,-1592,-1530,-1522,-1556,-1609,-1688,-1777,-1875,-1957,-2019,-2032,-2013,-2007,-2011,-2017,-2026,-2050,-2117,-2238,-2423,-2628,-2793,-2866,-2844,-2743,-2597,-2463,-2374,-2335,-2335,-2356,-2398,-2451,-2470,-2498,-2540,-2567,-2573,-2554,-2509,-2456,-2417,-2392,-2394,-2433,-2508,-2614,-2750,-2883,-2965,-2957,-2862,-2706,-2549,-2406,-2297,-2222,-2188,-2183,-2208,-2274,-2319,-2339,-2360,-2363,-2321,-2247,-2166,-2088,-2020,-1967,-1945,-1976,-2057,-2174,-2281,-2389,-2477,-2510,-2474,-2396,-2256,-2124,-2044,-1989,-1958,-1950,-1954,-1961,-1976,-2012,-2050,-2077,-2091,-2089,-2054,-2006,-1973,-1970,-2006,-2092,-2223,-2372,-2491,-2538,-2511,-2421,-2267,-2071,-1856,-1670,-1552,-1485,-1460,-1474,-1519,-1571,-1605,-1609,-1586,-1530,-1448,-1345,-1199,-1064,-989,-978,-1038,-1141,-1251,-1337,-1375,-1339,-1241,-1105,999055,-784,-641,-545,-518,-552,-634,-732,-825,-905,-978,-1039,-1089,-1116,-1109,-1065,-1031,-1063,-1162,-1308,-1496,-1693,-1858,-1966,-2024,-1974,-1851,-1693,-1537,-1396,-1285,-1231,-1232,-1256,-1288,-1338,-1386,-1428,-1462,-1478,-1455,-1396,-1320,-1247,-1187,-1161,-1204,-1323,-1487,-1654,-1799,-1898,-1885,-1778,-1623,-1461,-1346,-1299,-1302,-1311,-1332,-1375,-1442,-1520,-1581,-1615,-1609,-1580,-1546,-1509,-1437,-1360,-1376,-1460,-1578,-1732,-1941,-2167,-2351,-2441,-2409,-2271,-2087,-1920,-1800,-1738,-1726,-1770,-1858,-1929,-1980,-2001,-2011,-2059,-2072,-2028,-1958,-1886,-1841,-1834,-1880,-1966,-2084,-2233,-2393,-2522,-2590,-2589,-2507,-2353,-2170,-2008,-1886,-1804,-1758,-1755,-1797,-1856,-1920,-1978,-2030,-2073,-2108,-2131,-2117,-2077,-2039,-2041,-2129,-2242,-2351,-2473,-2606,-2680,-2661,-2548,-2337,-2077,-1850,-1691,-1596,-1565,-1589,-1605,-1607,-1620,-1639,-1649,-1638,-1598,-1541,-1480,-1425,-1391,-1384,-1409,-1459,-1564,-1728,-1941,-2150,-2267,-2272,-2181,-2048,-1883,-1711,-1577,-1506,-1479,-1489,-1521,-1578,-1641,-1683,-1714,-1705,-1650,-1571,-1472,-1372,-1300,-1288,-1335,-1430,-1579,-1760,-1935,-2063,-2074,-1981,-1846,-1681,-1518,-1415,-1393,-1424,-1507,-1596,-1655,-1687,-1717,-1748,-1758,-1740,-1721,-1701,-1696,-1699,-1706,-1763,-1911,-2131,-2345,-2496,-2548,-2551,-2509,-2439,-2366,-2261,-2140,-2070,-2037,-1982,-1926,-1936,-1967,-1991,-1997,-1986,-1962,-1905,-1811,-1772,-1790,-1811,-1863,-1967,-2117,-2279,-2421,-2546,-2640,-2632,-2520,-2344,-2174,-2037,-1935,-1870,-1841,-1859,-1933,-2055,-2108,-2124,-2117,-2081,-2022,-1944,-1858,-1787,-1748,-1753,-1807,-1910,-2072,-2308,-2510,-2592,-2571,-2487,-2327,-2141,-1988,-1878,-1818,-1810,-1835,-1877,-1924,-1964,-1949,-1938,-1952,-1947,-1888,-1802,-1736,-1668,-1657,-1697,-1784,-1920,-2095,-2280,-2456,-2564,-2535,-2383,-2175,-1974,-1840,-1789,-1781,-1782,-1781,-1778,-1792,-1843,-1848,-1814,-1777,-1715,-1630,-1533,-1447,-1406,-1440,-1550,-1715,-1911,-2106,-2262,-2347,-2392,-2326,-2153,-1933,-1714,-1521,-1384,-1321,-1316,-1331,-1327,-1311,-1296,-1267,-1211,-1102,-974,-852,-748,-694,-680,-696,-759,-858,-934,-982,-1007,-974,-925,-832,-690,-533,-418,-385,-393,-427,-467,-520,-581,-622,-624,-565,-469,-373,-279,-178,-85,-21,-38,-154,-328,-507,-651,-738,-755,-692,-573,-433,-292,-167,-92,-99,-162,-261,-369,-448,-485,-483,-463,-477,-467,-415,-366,-329,-313,-324,-390,-521,-689,-855,-970,-1008,-970,-846,-667,-475,-318,-234,-208,-202,-258,-364,-456,-526,-583,-638,-680,-622,-557,-547,-559,-582,-625,-690,-798,-961,-1154,-1313,-1423,-1459,-1411,-1259,-1054,-869,-728,-683,-712,-777,-858,-961,-1065,-1125,-1139,-1107,-1049,-997,-948,-896,-835,-813,-854,-990,-1184,-1404,-1632,-1817,-1901,-1877,-1795,-1658,-1522,-1392,-1283,-1232,-1249,-1332,-1387,-1417,-1445,-1465,-1462,-1449,-1414,-1335,-1259,-1230,-1220,-1193,-1185,-1259,-1430,-1655,-1885,-2063,-2132,-2084,-1956,-1776,-1614,-1494,-1433,-1438,-1471,-1499,-1518,-1524,-1509,-1473,-1431,-1389,-1346,-1298,-1256,-1228,-1226,-1245,-1286,-1385,-1536,-1700,-1829,-1863,-1798,-1664,-1522,-1364,-1227,-1142,-1101,-1082,-1073,-1113,-1173,-1192,-1153,-1091,-1019,-933,-837,-756,-687,-642,-635,-665,-743,-906,-1100,-1251,-1330,-1344,-1302,-1233,-1124,998997,-909,-861,-851,-860,-902,-1015,-1081,-1079,-1070,-1041,-946,-813,-735,-682,-610,-556,-545,-616,-754,-940,-1125,-1269,-1368,-1410,-1351,-1249,-1183,-1143,-1154,-1183,-1226,-1272,-1309,-1329,-1333,-1322,-1283,-1212,-1121,-1043,-969,-907,-897,-959,-1066,-1196,-1344,-1522,-1658,-1697,-1656,-1568,-1422,-1240,-1080,-963,-893,-887,-921,-942,-950,-977,-1014,-1010,-916,-829,-761,-711,-692,-716,-784,-901,-1063,-1240,-1401,-1532,-1621,-1662,-1662,-1601,-1461,-1303,-1203,-1149,-1176,-1242,-1321,-1372,-1389,-1410,-1420,-1387,-1305,-1224,-1170,-1144,-1104,-1086,-1137,-1241,-1401,-1606,-1798,-1906,-1938,-1888,-1758,-1606,-1457,-1344,-1266,-1218,-1242,-1306,-1377,-1439,-1473,-1472,-1432,-1354,-1256,-1140,-1008,-868,-760,-723,-778,-898,-1060,-1228,-1396,-1540,-1594,-1537,-1387,-1206,-1073,-1028,-1046,-1098,-1191,-1267,-1291,-1301,-1266,-1138,-991,-867,-764,-678,-608,-572,-578,-624,-719,-854,-989,-1147,-1294,-1373,-1363,-1254,-1059,-861,-719,-639,-614,-656,-713,-744,-745,-720,-644,-503,-362,-233,-103,4,88,123,114,69,-28,-159,-347,-519,-638,-664,-603,-490,-375,-298,-267,-288,-361,-440,-514,-547,-527,-481,-415,-333,-233,-133,-47,23,42,2,-83,-197,-365,-542,-676,-801,-858,-773,-616,-450,-313,-216,-202,-273,-388,-463,-556,-641,-683,-675,-609,-513,-404,-305,-269,-268,-295,-374,-550,-775,-977,-1124,-1218,-1235,-1163,-1023,-878,-763,-691,-665,-675,-705,-738,-770,-785,-749,-683,-596,-496,-379,-294,-267,-303,-382,-518,-703,-887,-1043,-1136,-1166,-1163,-1087,-960,-853,-746,-648,-656,-788,-952,-1110,-1242,-1316,-1349,-1334,-1262,-1141,-1020,-946,-856,-766,-725,-752,-838,-992,-1231,-1490,-1714,-1867,-1918,-1858,-1716,-1505,-1333,-1246,-1240,-1287,-1355,-1433,-1505,-1516,-1492,-1445,-1367,-1306,-1259,-1192,-1128,-1111,-1172,-1258,-1340,-1452,-1615,-1738,-1806,-1823,-1745,-1574,-1364,-1169,-1030,-973,-1006,-1114,-1257,-1367,-1381,-1332,-1251,-1157,-1054,-957,-864,-800,-795,-834,-897,-960,-1072,-1210,-1328,-1442,-1521,-1537,-1473,-1340,-1179,-1065,-1021,-1045,-1126,-1224,-1298,-1305,-1233,-1114,-990,-877,-750,-610,-483,-410,-395,-408,-444,-543,-674,-826,-979,-1126,-1200,-1182,-1092,-985,-893,-833,-844,-915,-1030,-1156,-1258,-1302,-1292,-1211,-1066,-913,-784,-6